{
  "schemaVersion": 1,
  "requestId": "16223957-cdc3-57d4-af7d-74f78016ca0e",
  "producerEpoch": "aaaaaaaa-aaaa-4aaa-8aaa-aaaaaaaaaaaa",
  "sequence": 1,
  "operation": "SET",
  "recommendation": "INSPECTION_RECOMMENDED",
  "reasonCode": "PREDICTED_BRAKE_DEGRADATION",
  "decisionId": "59e854e8-596b-568b-8a18-12c44fb3a88c",
  "serviceVersion": "3.0.0",
  "modelVersion": "brake-condition-demo-v1",
  "issuedAt": "2026-08-22T12:00:00.600Z",
  "expiresAt": "2026-08-22T12:00:30.600Z"
}
